{
  "apiUserSecretRef": {
    "name": "namecheap-credentials",
    "key": "apiUser"
  },
  "usernameSecretRef": {
    "name": "namecheap-credentials",
    "key": "username"
  },
  "clientIP": "203.0.113.10",
  "apiKeySecretRef": {
    "name": "namecheap-credentials",
    "key": "apiKey"
  },
  "useSandbox": true,
  "ttl": 60
}
